"No.","Time","Source","Destination","Protocol","Length","Info"
"1","0.000000","192.168.137.1","224.0.0.251","MDNS","512","Standard query response 0x0000 TXT, cache flush PTR _nvstream_dbd._tcp.local PTR 3.9.0.97-DESKTOP-5OTFDPV.2b65c40b-e5b2-4cf5-a707-10b0dde7f125._nvstream_dbd._tcp.local SRV, cache flush 0 0 47989 DESKTOP-5OTFDPV.local PTR, cache flush DESKTOP-5OTFDPV.local PTR, cache flush DESKTOP-5OTFDPV.local A, cache flush 192.168.137.1 AAAA, cache flush fe80::7df4:d80f:f648:88ee NSEC, cache flush 3.9.0.97-DESKTOP-5OTFDPV.2b65c40b-e5b2-4cf5-a707-10b0dde7f125._nvstream_dbd._tcp.local NSEC, cache flush 1.137.168.192.in-addr.arpa NSEC, cache flush E.E.8.8.8.4.6.F.F.0.8.D.4.F.D.7.0.0.0.0.0.0.0.0.0.0.0.0.0.8.E.F.ip6.arpa NSEC, cache flush DESKTOP-5OTFDPV.local OPT"
"2","2.936681","192.168.137.119","192.168.137.1","DNS","78","Standard query 0x836f A graph.facebook.com"
"3","2.982174","192.168.137.1","192.168.137.119","DNS","259","Standard query response 0x836f A graph.facebook.com CNAME api.facebook.com CNAME star.c10r.facebook.com A 157.240.11.17 NS a.ns.c10r.facebook.com NS b.ns.c10r.facebook.com A 69.171.239.11 AAAA 2a03:2880:fffe:b:face:b00c:0:99 A 69.171.255.11 AAAA 2a03:2880:ffff:b:face:b00c:0:99"
"4","3.054745","192.168.137.119","157.240.11.17","TCP","74","42358  >  443 [SYN] Seq=0 Win=65535 Len=0 MSS=1460 SACK_PERM=1 TSval=3068437 TSecr=0 WS=256"
"5","3.560944","192.168.137.119","192.168.137.1","DNS","81","Standard query 0x8327 A service.supercell.net"
"6","3.560945","192.168.137.119","192.168.137.1","DNS","86","Standard query 0xf7b8 A android.clients.google.com"
"7","3.575006","192.168.137.1","192.168.137.119","DNS","262","Standard query response 0xf7b8 A android.clients.google.com CNAME android.l.google.com A 216.58.219.46 NS ns4.google.com NS ns1.google.com NS ns2.google.com NS ns3.google.com A 216.239.32.10 A 216.239.34.10 A 216.239.36.10 A 216.239.38.10"
"8","3.580390","192.168.137.1","192.168.137.119","DNS","402","Standard query response 0x8327 A service.supercell.net A 54.243.113.224 A 23.23.221.118 A 54.235.246.134 A 54.235.139.65 A 23.21.109.178 A 54.235.106.17 NS ns-1634.awsdns-12.co.uk NS ns-1427.awsdns-50.org NS ns-865.awsdns-44.net NS ns-165.awsdns-20.com A 205.251.192.165 AAAA 2600:9000:5300:a500::1 A 205.251.198.98 AAAA 2600:9000:5306:6200::1"
"9","3.584740","192.168.137.119","216.58.219.46","TCP","74","37505  >  443 [SYN] Seq=0 Win=65535 Len=0 MSS=1460 SACK_PERM=1 TSval=3068596 TSecr=0 WS=256"
"10","3.588152","192.168.137.119","54.243.113.224","TCP","74","37361  >  443 [SYN] Seq=0 Win=65535 Len=0 MSS=1460 SACK_PERM=1 TSval=3068597 TSecr=0 WS=256"
"11","3.590132","192.168.137.119","216.58.219.46","TCP","74","37507  >  443 [SYN] Seq=0 Win=65535 Len=0 MSS=1460 SACK_PERM=1 TSval=3068598 TSecr=0 WS=256"
"12","3.681793","192.168.137.119","216.58.219.46","TCP","74","37508  >  443 [SYN] Seq=0 Win=65535 Len=0 MSS=1460 SACK_PERM=1 TSval=3068623 TSecr=0 WS=256"
"13","4.044918","192.168.137.119","216.58.219.46","TCP","74","37509  >  443 [SYN] Seq=0 Win=65535 Len=0 MSS=1460 SACK_PERM=1 TSval=3068734 TSecr=0 WS=256"
"14","4.074263","192.168.137.119","157.240.11.17","TCP","74","[TCP Retransmission] 42358  >  443 [SYN] Seq=0 Win=65535 Len=0 MSS=1460 SACK_PERM=1 TSval=3068738 TSecr=0 WS=256"
"15","4.078451","157.240.11.17","192.168.137.119","TCP","74","443  >  42358 [SYN, ACK] Seq=0 Ack=1 Win=27960 Len=0 MSS=1386 SACK_PERM=1 TSval=1324157070 TSecr=3068437 WS=256"
"16","4.082654","157.240.11.17","192.168.137.119","TCP","74","[TCP Retransmission] 443  >  42358 [SYN, ACK] Seq=0 Ack=1 Win=27960 Len=0 MSS=1386 SACK_PERM=1 TSval=1324157089 TSecr=3068437 WS=256"
"17","4.083911","192.168.137.119","157.240.11.17","TCP","66","42358  >  443 [ACK] Seq=1 Ack=1 Win=87808 Len=0 TSval=3068745 TSecr=1324157070"
"18","4.085816","192.168.137.119","157.240.11.17","TLSv1.2","251","Client Hello"
"19","4.085818","192.168.137.119","157.240.11.17","TCP","66","[TCP Dup ACK 17#1] 42358  >  443 [ACK] Seq=186 Ack=1 Win=87808 Len=0 TSval=3068746 TSecr=1324157070"
"20","4.090306","157.240.11.17","192.168.137.119","TCP","66","443  >  42358 [ACK] Seq=1 Ack=186 Win=29184 Len=0 TSval=1324157099 TSecr=3068746"
"21","4.091540","157.240.11.17","192.168.137.119","TLSv1.2","1440","Server Hello"
"22","4.091993","157.240.11.17","192.168.137.119","TCP","1440","443  >  42358 [ACK] Seq=1375 Ack=186 Win=29184 Len=1374 TSval=1324157100 TSecr=3068746 [TCP segment of a reassembled PDU]"
"23","4.092344","157.240.11.17","192.168.137.119","TLSv1.2","813","Certificate, Server Key Exchange, Server Hello Done"
"24","4.097594","192.168.137.119","157.240.11.17","TCP","66","42358  >  443 [ACK] Seq=186 Ack=1375 Win=90368 Len=0 TSval=3068749 TSecr=1324157100"
"25","4.097595","192.168.137.119","157.240.11.17","TCP","66","42358  >  443 [ACK] Seq=186 Ack=2749 Win=93184 Len=0 TSval=3068749 TSecr=1324157100"
"26","4.097596","192.168.137.119","157.240.11.17","TCP","66","42358  >  443 [ACK] Seq=186 Ack=3496 Win=96000 Len=0 TSval=3068749 TSecr=1324157100"
"27","4.138746","192.168.137.119","157.240.11.17","TLSv1.2","192","Client Key Exchange, Change Cipher Spec, Encrypted Handshake Message"
"28","4.144479","157.240.11.17","192.168.137.119","TLSv1.2","324","New Session Ticket, Change Cipher Spec, Encrypted Handshake Message"
"29","4.148944","192.168.137.119","157.240.11.17","TLSv1.2","663","Application Data"
"30","4.189605","157.240.11.17","192.168.137.119","TLSv1.2","1243","Application Data"
"31","4.284125","192.168.137.119","157.240.11.17","TCP","66","42358  >  443 [ACK] Seq=909 Ack=4931 Win=101376 Len=0 TSval=3068806 TSecr=1324157199"
"32","4.287952","157.240.11.17","192.168.137.119","TLSv1.2","1243","[TCP Spurious Retransmission] , Application Data"
"33","4.292244","192.168.137.119","157.240.11.17","TCP","78","[TCP Dup ACK 31#1] 42358  >  443 [ACK] Seq=909 Ack=4931 Win=101376 Len=0 TSval=3068808 TSecr=1324157277 SLE=3754 SRE=4931"
"34","4.587170","192.168.137.119","216.58.219.46","TCP","74","[TCP Retransmission] 37505  >  443 [SYN] Seq=0 Win=65535 Len=0 MSS=1460 SACK_PERM=1 TSval=3068897 TSecr=0 WS=256"
"35","4.590009","192.168.137.119","54.243.113.224","TCP","74","[TCP Retransmission] 37361  >  443 [SYN] Seq=0 Win=65535 Len=0 MSS=1460 SACK_PERM=1 TSval=3068898 TSecr=0 WS=256"
"36","4.593335","192.168.137.119","216.58.219.46","TCP","74","[TCP Retransmission] 37507  >  443 [SYN] Seq=0 Win=65535 Len=0 MSS=1460 SACK_PERM=1 TSval=3068899 TSecr=0 WS=256"
"37","4.688191","192.168.137.119","216.58.219.46","TCP","74","[TCP Retransmission] 37508  >  443 [SYN] Seq=0 Win=65535 Len=0 MSS=1460 SACK_PERM=1 TSval=3068925 TSecr=0 WS=256"
"38","5.069891","192.168.137.119","216.58.219.46","TCP","74","[TCP Retransmission] 37509  >  443 [SYN] Seq=0 Win=65535 Len=0 MSS=1460 SACK_PERM=1 TSval=3069035 TSecr=0 WS=256"
"39","5.069892","192.168.137.119","192.168.137.1","DNS","82","Standard query 0xa8da AAAA gamea.clashofclans.com"
"40","5.069893","192.168.137.119","192.168.137.1","DNS","82","Standard query 0xfea5 A inbox.clashofclans.com"
"41","5.074055","216.58.219.46","192.168.137.119","TCP","74","443  >  37509 [SYN, ACK] Seq=0 Ack=1 Win=42408 Len=0 MSS=1380 SACK_PERM=1 TSval=4059504905 TSecr=3068734 WS=256"
"42","5.077869","192.168.137.119","216.58.219.46","TCP","66","37509  >  443 [ACK] Seq=1 Ack=1 Win=87808 Len=0 TSval=3069044 TSecr=4059504905"
"43","5.081363","192.168.137.1","192.168.137.119","DNS","164","Standard query response 0xa8da AAAA gamea.clashofclans.com SOA ns-1002.awsdns-61.net"
"44","5.083151","192.168.137.1","192.168.137.119","DNS","496","Standard query response 0xfea5 A inbox.clashofclans.com A 54.192.142.208 A 54.192.142.165 A 54.192.142.61 A 54.192.142.190 A 54.192.142.39 A 54.192.142.80 A 54.192.142.251 A 54.192.142.4 NS ns-378.awsdns-47.com NS ns-1002.awsdns-61.net NS ns-1123.awsdns-12.org NS ns-1727.awsdns-23.co.uk A 205.251.193.122 AAAA 2600:9000:5301:7a00::1 A 205.251.195.234 AAAA 2600:9000:5303:ea00::1 A 205.251.196.99 A 205.251.198.191 AAAA 2600:9000:5306:bf00::1"
"45","5.086315","192.168.137.119","192.168.137.1","DNS","82","Standard query 0xc193 A gamea.clashofclans.com"
"46","5.091234","192.168.137.119","54.192.142.208","TCP","74","40829  >  443 [SYN] Seq=0 Win=65535 Len=0 MSS=1460 SACK_PERM=1 TSval=3069048 TSecr=0 WS=256"
"47","5.101737","192.168.137.1","192.168.137.119","DNS","496","Standard query response 0xc193 A gamea.clashofclans.com A 54.236.34.54 A 34.201.48.126 A 34.200.234.93 A 54.236.240.10 A 54.173.201.214 A 34.239.226.33 A 54.87.131.234 A 34.200.218.253 NS ns-1123.awsdns-12.org NS ns-1002.awsdns-61.net NS ns-1727.awsdns-23.co.uk NS ns-378.awsdns-47.com A 205.251.193.122 AAAA 2600:9000:5301:7a00::1 A 205.251.195.234 AAAA 2600:9000:5303:ea00::1 A 205.251.196.99 A 205.251.198.191 AAAA 2600:9000:5306:bf00::1"
"48","5.109340","192.168.137.119","54.236.34.54","TCP","74","39826  >  9339 [SYN] Seq=0 Win=65535 Len=0 MSS=1460 SACK_PERM=1 TSval=3069053 TSecr=0 WS=256"
"49","5.123068","192.168.137.119","216.58.219.46","TLSv1.2","275","Client Hello"
"50","5.133343","216.58.219.46","192.168.137.119","TCP","66","443  >  37509 [ACK] Seq=1 Ack=210 Win=43520 Len=0 TSval=4059504959 TSecr=3069057"
"51","5.133685","216.58.219.46","192.168.137.119","TLSv1.2","217","Server Hello, Change Cipher Spec, Encrypted Handshake Message"
"52","5.139039","192.168.137.119","216.58.219.46","TCP","66","37509  >  443 [ACK] Seq=210 Ack=152 Win=88832 Len=0 TSval=3069062 TSecr=4059504960"
"53","5.142051","192.168.137.119","216.58.219.46","TLSv1.2","282","Change Cipher Spec, Encrypted Handshake Message, Encrypted Handshake Message"
"54","5.247455","216.58.219.46","192.168.137.119","TCP","66","443  >  37509 [ACK] Seq=152 Ack=426 Win=44800 Len=0 TSval=4059504979 TSecr=3069063"
"55","5.287211","192.168.137.119","216.58.219.46","TLSv1.2","1017","Application Data"
"56","5.297373","216.58.219.46","192.168.137.119","TCP","66","443  >  37509 [ACK] Seq=152 Ack=1377 Win=46592 Len=0 TSval=4059505124 TSecr=3069106"
"57","5.339137","216.58.219.46","192.168.137.119","TLSv1.2","524","Application Data"
"58","5.339427","216.58.219.46","192.168.137.119","TLSv1.2","357","Application Data"
"59","5.341763","216.58.219.46","192.168.137.119","TLSv1.2","125","Application Data"
"60","5.342575","216.58.219.46","192.168.137.119","TLSv1.2","100","Application Data"
"61","5.364109","216.58.219.46","192.168.137.119","TCP","100","[TCP Retransmission] 443  >  37509 [PSH, ACK] Seq=960 Ack=1377 Win=46592 Len=34 TSval=4059505193 TSecr=3069106"
"62","5.477787","192.168.137.119","216.58.219.46","TCP","66","37509  >  443 [ACK] Seq=1377 Ack=901 Win=90880 Len=0 TSval=3069164 TSecr=4059505165"
"63","5.477789","192.168.137.119","216.58.219.46","TCP","78","37509  >  443 [ACK] Seq=1377 Ack=994 Win=90880 Len=0 TSval=3069164 TSecr=4059505166 SLE=960 SRE=994"
"64","5.678072","192.168.137.119","192.168.137.1","DNS","78","Standard query 0xad09 A www.googleapis.com"
"65","5.696434","192.168.137.1","192.168.137.119","DNS","376","Standard query response 0xad09 A www.googleapis.com CNAME googleapis.l.google.com A 172.217.11.170 A 172.217.11.74 A 216.58.219.10 A 216.58.216.10 A 172.217.5.202 A 172.217.5.74 A 172.217.4.170 A 216.58.219.42 NS ns3.google.com NS ns1.google.com NS ns2.google.com NS ns4.google.com A 216.239.32.10 A 216.239.34.10 A 216.239.36.10 A 216.239.38.10"
"66","5.705668","192.168.137.119","172.217.11.170","TCP","74","40080  >  443 [SYN] Seq=0 Win=65535 Len=0 MSS=1460 SACK_PERM=1 TSval=3069232 TSecr=0 WS=256"
"67","6.094333","192.168.137.119","54.192.142.208","TCP","74","[TCP Retransmission] 40829  >  443 [SYN] Seq=0 Win=65535 Len=0 MSS=1460 SACK_PERM=1 TSval=3069349 TSecr=0 WS=256"
"68","6.110720","192.168.137.119","54.236.34.54","TCP","74","[TCP Retransmission] 39826  >  9339 [SYN] Seq=0 Win=65535 Len=0 MSS=1460 SACK_PERM=1 TSval=3069354 TSecr=0 WS=256"
"69","6.188413","54.236.34.54","192.168.137.119","TCP","74","9339  >  39826 [SYN, ACK] Seq=0 Ack=1 Win=26847 Len=0 MSS=1386 SACK_PERM=1 TSval=2335199783 TSecr=3069053 WS=128"
"70","6.189886","54.236.34.54","192.168.137.119","TCP","74","[TCP Out-Of-Order] 9339  >  39826 [SYN, ACK] Seq=0 Ack=1 Win=26847 Len=0 MSS=1386 SACK_PERM=1 TSval=2335199783 TSecr=3069053 WS=128"
"71","6.292146","192.168.137.119","54.236.34.54","TCP","66","39826  >  9339 [ACK] Seq=1 Ack=1 Win=87808 Len=0 TSval=3069408 TSecr=2335199783"
"72","6.292147","192.168.137.119","54.236.34.54","TCP","66","[TCP Dup ACK 71#1] 39826  >  9339 [ACK] Seq=1 Ack=1 Win=87808 Len=0 TSval=3069408 TSecr=2335199783"
"73","6.314571","192.168.137.119","54.236.34.54","TCP","145","39826  >  9339 [PSH, ACK] Seq=1 Ack=1 Win=87808 Len=79 TSval=3069414 TSecr=2335199783"
"74","6.386284","54.236.34.54","192.168.137.119","TCP","66","9339  >  39826 [ACK] Seq=1 Ack=80 Win=26880 Len=0 TSval=2335199833 TSecr=3069414"
"75","6.386649","54.236.34.54","192.168.137.119","TCP","101","9339  >  39826 [PSH, ACK] Seq=1 Ack=80 Win=26880 Len=35 TSval=2335199833 TSecr=3069414"
"76","6.507395","192.168.137.119","54.236.34.54","TCP","66","39826  >  9339 [ACK] Seq=80 Ack=36 Win=87808 Len=0 TSval=3069473 TSecr=2335199833"
"77","6.545247","192.168.137.119","54.236.34.54","TCP","446","39826  >  9339 [PSH, ACK] Seq=80 Ack=36 Win=87808 Len=380 TSval=3069483 TSecr=2335199833"
"78","6.593311","192.168.137.119","216.58.219.46","TCP","74","[TCP Retransmission] 37505  >  443 [SYN] Seq=0 Win=65535 Len=0 MSS=1460 SACK_PERM=1 TSval=3069498 TSecr=0 WS=256"
"79","6.596950","216.58.219.46","192.168.137.119","TCP","74","443  >  37505 [SYN, ACK] Seq=0 Ack=1 Win=42408 Len=0 MSS=1380 SACK_PERM=1 TSval=4193434929 TSecr=3068596 WS=256"
"80","6.597428","192.168.137.119","54.243.113.224","TCP","74","[TCP Retransmission] 37361  >  443 [SYN] Seq=0 Win=65535 Len=0 MSS=1460 SACK_PERM=1 TSval=3069500 TSecr=0 WS=256"
"81","6.597428","192.168.137.119","216.58.219.46","TCP","74","[TCP Retransmission] 37507  >  443 [SYN] Seq=0 Win=65535 Len=0 MSS=1460 SACK_PERM=1 TSval=3069500 TSecr=0 WS=256"
"82","6.599716","216.58.219.46","192.168.137.119","TCP","74","[TCP Out-Of-Order] 443  >  37505 [SYN, ACK] Seq=0 Ack=1 Win=42408 Len=0 MSS=1380 SACK_PERM=1 TSval=4193434935 TSecr=3068596 WS=256"
"83","6.601390","192.168.137.119","216.58.219.46","TCP","66","37505  >  443 [ACK] Seq=1 Ack=1 Win=87808 Len=0 TSval=3069501 TSecr=4193434929"
"84","6.640888","54.236.34.54","192.168.137.119","TCP","528","9339  >  39826 [PSH, ACK] Seq=36 Ack=460 Win=28032 Len=462 TSval=2335199892 TSecr=3069483"
"85","6.647820","54.236.34.54","192.168.137.119","TCP","1440","9339  >  39826 [ACK] Seq=498 Ack=460 Win=28032 Len=1374 TSval=2335199896 TSecr=3069483"
"86","6.720236","192.168.137.119","216.58.219.46","TLSv1.2","275","Client Hello"
"87","6.720237","192.168.137.119","216.58.219.46","TCP","74","[TCP Retransmission] 37508  >  443 [SYN] Seq=0 Win=65535 Len=0 MSS=1460 SACK_PERM=1 TSval=3069526 TSecr=0 WS=256"
"88","6.720238","192.168.137.119","172.217.11.170","TCP","74","[TCP Retransmission] 40080  >  443 [SYN] Seq=0 Win=65535 Len=0 MSS=1460 SACK_PERM=1 TSval=3069533 TSecr=0 WS=256"
"89","6.725439","192.168.137.119","216.58.219.46","TCP","66","[TCP Dup ACK 83#1] 37505  >  443 [ACK] Seq=210 Ack=1 Win=87808 Len=0 TSval=3069537 TSecr=4193434929"
"90","6.725441","192.168.137.119","54.236.34.54","TCP","66","39826  >  9339 [ACK] Seq=460 Ack=1872 Win=91648 Len=0 TSval=3069537 TSecr=2335199892"
"91","6.753833","216.58.219.46","192.168.137.119","TCP","66","443  >  37505 [ACK] Seq=1 Ack=210 Win=43520 Len=0 TSval=4193435062 TSecr=3069503"
"92","6.760922","216.58.219.46","192.168.137.119","TLSv1.2","217","Server Hello, Change Cipher Spec, Encrypted Handshake Message"
"93","6.761254","216.58.219.46","192.168.137.119","TCP","74","443  >  37508 [SYN, ACK] Seq=0 Ack=1 Win=42408 Len=0 MSS=1380 SACK_PERM=1 TSval=632065735 TSecr=3068623 WS=256"
"94","6.815591","54.236.34.54","192.168.137.119","TCP","1440","9339  >  39826 [ACK] Seq=1872 Ack=460 Win=28032 Len=1374 TSval=2335199940 TSecr=3069537"
"95","6.819411","54.236.34.54","192.168.137.119","TCP","1404","9339  >  39826 [PSH, ACK] Seq=3246 Ack=460 Win=28032 Len=1338 TSval=2335199940 TSecr=3069537"
"96","6.913154","192.168.137.119","216.58.219.46","TCP","74","37513  >  443 [SYN] Seq=0 Win=65535 Len=0 MSS=1460 SACK_PERM=1 TSval=3069579 TSecr=0 WS=256"
"97","6.915006","192.168.137.119","216.58.219.46","TCP","66","37505  >  443 [ACK] Seq=210 Ack=152 Win=88832 Len=0 TSval=3069595 TSecr=4193435063"
"98","6.915007","192.168.137.119","216.58.219.46","TCP","66","37508  >  443 [ACK] Seq=1 Ack=1 Win=87808 Len=0 TSval=3069595 TSecr=632065735"
"99","6.915007","192.168.137.119","54.236.34.54","TCP","66","39826  >  9339 [ACK] Seq=460 Ack=4584 Win=97024 Len=0 TSval=3069595 TSecr=2335199940"
"100","6.917711","192.168.137.119","216.58.219.46","TLSv1.2","275","Client Hello"
"101","6.917715","192.168.137.119","216.58.219.46","TLSv1.2","282","Change Cipher Spec, Encrypted Handshake Message, Encrypted Handshake Message"
"102","6.941966","216.58.219.46","192.168.137.119","TCP","66","443  >  37508 [ACK] Seq=1 Ack=210 Win=43520 Len=0 TSval=632065929 TSecr=3069596"
"103","6.945223","216.58.219.46","192.168.137.119","TLSv1.2","217","Server Hello, Change Cipher Spec, Encrypted Handshake Message"
"104","6.948676","192.168.137.119","216.58.219.46","TCP","66","37508  >  443 [ACK] Seq=210 Ack=152 Win=88832 Len=0 TSval=3069605 TSecr=632065930"
"105","6.951394","192.168.137.119","216.58.219.46","TLSv1.2","282","Change Cipher Spec, Encrypted Handshake Message, Encrypted Handshake Message"
"106","6.962771","216.58.219.46","192.168.137.119","TCP","66","443  >  37505 [ACK] Seq=152 Ack=426 Win=44800 Len=0 TSval=4193435259 TSecr=3069596"
"107","6.967048","192.168.137.119","216.58.219.46","TLSv1.2","983","Application Data"
"108","6.975577","216.58.219.46","192.168.137.119","TCP","66","443  >  37505 [ACK] Seq=152 Ack=1343 Win=46592 Len=0 TSval=4193435309 TSecr=3069611"
"109","7.012327","216.58.219.46","192.168.137.119","TCP","66","443  >  37508 [ACK] Seq=152 Ack=426 Win=44800 Len=0 TSval=632065962 TSecr=3069606"
"110","7.027849","216.58.219.46","192.168.137.119","TLSv1.2","524","Application Data"
"111","7.047705","216.58.219.46","192.168.137.119","TLSv1.2","495","Application Data"
"112","7.047916","216.58.219.46","192.168.137.119","TLSv1.2","216","Application Data"
"113","7.055732","216.58.219.46","192.168.137.119","TLSv1.2","100","Application Data"
"114","7.094988","216.58.219.46","192.168.137.119","TCP","100","[TCP Retransmission] 443  >  37505 [PSH, ACK] Seq=1189 Ack=1343 Win=46592 Len=34 TSval=4193435430 TSecr=3069611"
"115","7.126063","192.168.137.119","216.58.219.46","TCP","74","37514  >  443 [SYN] Seq=0 Win=65535 Len=0 MSS=1460 SACK_PERM=1 TSval=3069656 TSecr=0 WS=256"
"116","7.128180","192.168.137.119","216.58.219.46","TLSv1.2","1108","Application Data"
"117","7.128185","192.168.137.119","216.58.219.46","TCP","66","37505  >  443 [ACK] Seq=1343 Ack=1039 Win=90880 Len=0 TSval=3069659 TSecr=4193435356"
"118","7.128186","192.168.137.119","216.58.219.46","TCP","78","37505  >  443 [ACK] Seq=1343 Ack=1223 Win=91904 Len=0 TSval=3069659 TSecr=4193435358 SLE=1189 SRE=1223"
"119","7.139455","216.58.219.46","192.168.137.119","TCP","66","443  >  37508 [ACK] Seq=152 Ack=1468 Win=47360 Len=0 TSval=632066139 TSecr=3069659"
"120","7.199902","216.58.219.46","192.168.137.119","TLSv1.2","524","Application Data"
"121","7.200204","216.58.219.46","192.168.137.119","TLSv1.2","335","Application Data"
"122","7.200530","216.58.219.46","192.168.137.119","TLSv1.2","181","Application Data"
"123","7.205256","216.58.219.46","192.168.137.119","TLSv1.2","100","Application Data"
"124","7.320317","192.168.137.119","216.58.219.46","TCP","66","37508  >  443 [ACK] Seq=1468 Ack=879 Win=90880 Len=0 TSval=3069716 TSecr=632066205"
"125","7.325812","192.168.137.119","216.58.219.46","TCP","66","37508  >  443 [ACK] Seq=1468 Ack=1028 Win=90880 Len=0 TSval=3069718 TSecr=632066206"
"126","7.517747","192.168.137.119","172.217.11.170","TCP","74","40083  >  443 [SYN] Seq=0 Win=65535 Len=0 MSS=1460 SACK_PERM=1 TSval=3069775 TSecr=0 WS=256"
"127","7.893890","192.168.137.119","216.58.219.46","TCP","74","[TCP Retransmission] 37513  >  443 [SYN] Seq=0 Win=65535 Len=0 MSS=1460 SACK_PERM=1 TSval=3069881 TSecr=0 WS=256"
"128","7.898253","216.58.219.46","192.168.137.119","TCP","74","443  >  37513 [SYN, ACK] Seq=0 Ack=1 Win=42408 Len=0 MSS=1380 SACK_PERM=1 TSval=4059507729 TSecr=3069579 WS=256"
"129","7.902105","192.168.137.119","216.58.219.46","TCP","66","37513  >  443 [ACK] Seq=1 Ack=1 Win=87808 Len=0 TSval=3069891 TSecr=4059507729"
"130","7.902107","192.168.137.119","216.58.219.46","TLSv1.2","583","Client Hello"
"131","7.912815","216.58.219.46","192.168.137.119","TCP","66","443  >  37513 [ACK] Seq=1 Ack=518 Win=43520 Len=0 TSval=4059507741 TSecr=3069891"
"132","7.913115","216.58.219.46","192.168.137.119","TLSv1.2","222","Server Hello, Change Cipher Spec, Encrypted Handshake Message"
"133","7.918095","192.168.137.119","216.58.219.46","TCP","66","37513  >  443 [ACK] Seq=518 Ack=157 Win=88832 Len=0 TSval=3069896 TSecr=4059507742"
"134","7.918097","192.168.137.119","216.58.219.46","TLSv1.2","117","Change Cipher Spec, Encrypted Handshake Message"
"135","7.926892","192.168.137.119","216.58.219.46","TLSv1.2","159","Application Data"
"136","7.927426","216.58.219.46","192.168.137.119","TLSv1.2","135","Application Data"
"137","7.927612","192.168.137.119","216.58.219.46","TCP","1434","37513  >  443 [ACK] Seq=662 Ack=157 Win=88832 Len=1368 TSval=3069897 TSecr=4059507742 [TCP segment of a reassembled PDU]"
"138","7.927616","192.168.137.119","216.58.219.46","TLSv1.2","865","Application Data"
"139","7.927617","192.168.137.119","216.58.219.46","TLSv1.2","724","Application Data"
"140","7.932672","216.58.219.46","192.168.137.119","TLSv1.2","104","Application Data"
"141","7.932957","192.168.137.119","216.58.219.46","TLSv1.2","104","Application Data"
"142","7.934050","216.58.219.46","192.168.137.119","TCP","66","443  >  37513 [ACK] Seq=264 Ack=2829 Win=49152 Len=0 TSval=4059507763 TSecr=3069897"
"143","7.941543","216.58.219.46","192.168.137.119","TCP","66","443  >  37513 [ACK] Seq=264 Ack=3525 Win=51712 Len=0 TSval=4059507769 TSecr=3069898"
"144","7.974515","192.168.137.119","216.58.219.46","TCP","66","37513  >  443 [ACK] Seq=3525 Ack=264 Win=88832 Len=0 TSval=3069913 TSecr=4059507762"
"145","8.005042","216.58.219.46","192.168.137.119","TLSv1.2","379","Application Data"
"146","8.005341","216.58.219.46","192.168.137.119","TLSv1.2","818","Application Data"
"147","8.006131","216.58.219.46","192.168.137.119","TLSv1.2","202","Application Data"
"148","8.006425","216.58.219.46","192.168.137.119","TLSv1.2","112","Application Data"
"149","8.041823","192.168.137.119","216.58.219.46","TCP","66","37513  >  443 [ACK] Seq=3525 Ack=577 Win=89856 Len=0 TSval=3069933 TSecr=4059507834"
"150","8.041825","192.168.137.119","216.58.219.46","TCP","66","37513  >  443 [ACK] Seq=3525 Ack=1329 Win=91392 Len=0 TSval=3069933 TSecr=4059507834"
"151","8.041825","192.168.137.119","216.58.219.46","TCP","66","37513  >  443 [ACK] Seq=3525 Ack=1465 Win=92928 Len=0 TSval=3069933 TSecr=4059507836"
"152","8.041826","192.168.137.119","216.58.219.46","TCP","66","37513  >  443 [ACK] Seq=3525 Ack=1511 Win=92928 Len=0 TSval=3069933 TSecr=4059507836"
"153","8.042768","216.58.219.46","192.168.137.119","TLSv1.2","112","[TCP Spurious Retransmission] , Application Data"
"154","8.043163","192.168.137.119","216.58.219.46","TLSv1.2","112","Application Data"
"155","8.046931","192.168.137.119","216.58.219.46","TCP","78","[TCP Dup ACK 152#1] 37513  >  443 [ACK] Seq=3571 Ack=1511 Win=92928 Len=0 TSval=3069935 TSecr=4059507872 SLE=1465 SRE=1511"
"156","8.090082","216.58.219.46","192.168.137.119","TCP","66","443  >  37513 [ACK] Seq=1511 Ack=3571 Win=51712 Len=0 TSval=4059507882 TSecr=3069933"
"157","8.097778","192.168.137.119","54.192.142.208","TCP","74","[TCP Retransmission] 40829  >  443 [SYN] Seq=0 Win=65535 Len=0 MSS=1460 SACK_PERM=1 TSval=3069950 TSecr=0 WS=256"
"158","8.107578","54.192.142.208","192.168.137.119","TCP","74","443  >  40829 [SYN, ACK] Seq=0 Ack=1 Win=28960 Len=0 MSS=1386 SACK_PERM=1 TSval=3577308879 TSecr=3069048 WS=256"
"159","8.112623","192.168.137.119","54.192.142.208","TCP","66","40829  >  443 [ACK] Seq=1 Ack=1 Win=87808 Len=0 TSval=3069954 TSecr=3577308879"
"160","8.112624","192.168.137.119","216.58.219.46","TLSv1.2","150","Application Data"
"161","8.114424","192.168.137.119","54.192.142.208","TLSv1.2","255","Client Hello"
"162","8.114425","192.168.137.119","216.58.219.46","TLSv1.2","589","Application Data"
"163","8.115181","54.192.142.208","192.168.137.119","TCP","74","[TCP Out-Of-Order] 443  >  40829 [SYN, ACK] Seq=0 Ack=1 Win=28960 Len=0 MSS=1386 SACK_PERM=1 TSval=3577308879 TSecr=3069048 WS=256"
"164","8.120158","192.168.137.119","54.192.142.208","TCP","66","[TCP Dup ACK 159#1] 40829  >  443 [ACK] Seq=190 Ack=1 Win=87808 Len=0 TSval=3069957 TSecr=3577308879"
"165","8.120160","192.168.137.119","216.58.219.46","TCP","74","[TCP Retransmission] 37514  >  443 [SYN] Seq=0 Win=65535 Len=0 MSS=1460 SACK_PERM=1 TSval=3069957 TSecr=0 WS=256"
"166","8.122249","216.58.219.46","192.168.137.119","TCP","66","443  >  37513 [ACK] Seq=1511 Ack=3655 Win=51712 Len=0 TSval=4059507948 TSecr=3069954"
"167","8.127102","216.58.219.46","192.168.137.119","TCP","66","443  >  37513 [ACK] Seq=1511 Ack=4178 Win=54528 Len=0 TSval=4059507950 TSecr=3069955"
"168","8.128656","216.58.219.46","192.168.137.119","TCP","74","443  >  37514 [SYN, ACK] Seq=0 Ack=1 Win=42408 Len=0 MSS=1380 SACK_PERM=1 TSval=2297145908 TSecr=3069656 WS=256"
"169","8.128955","54.192.142.208","192.168.137.119","TCP","66","443  >  40829 [ACK] Seq=1 Ack=190 Win=30208 Len=0 TSval=3577308881 TSecr=3069954"
"170","8.132844","54.192.142.208","192.168.137.119","TLSv1.2","1440","Server Hello"
"171","8.133003","192.168.137.119","216.58.219.46","TCP","66","37514  >  443 [ACK] Seq=1 Ack=1 Win=87808 Len=0 TSval=3069960 TSecr=2297145908"
"172","8.169010","192.168.137.119","54.192.142.208","TCP","66","40829  >  443 [ACK] Seq=190 Ack=1375 Win=90368 Len=0 TSval=3069962 TSecr=3577308881"
"173","8.179629","216.58.219.46","192.168.137.119","TLSv1.2","132","Application Data"
"174","8.180013","216.58.219.46","192.168.137.119","TLSv1.2","914","Application Data"
"175","8.181147","216.58.219.46","192.168.137.119","TLSv1.2","172","Application Data"
"176","8.181523","216.58.219.46","192.168.137.119","TLSv1.2","112","Application Data"
"177","8.183458","192.168.137.119","216.58.219.46","TCP","66","37513  >  443 [ACK] Seq=4178 Ack=1577 Win=92928 Len=0 TSval=3069976 TSecr=4059508011"
"178","8.183460","192.168.137.119","216.58.219.46","TCP","66","37513  >  443 [ACK] Seq=4178 Ack=2425 Win=94464 Len=0 TSval=3069976 TSecr=4059508011"
"179","8.184180","54.192.142.208","192.168.137.119","TLSv1.2","1298","Certificate, Server Key Exchange, Server Hello Done"
"180","8.185715","192.168.137.119","216.58.219.46","TCP","66","37513  >  443 [ACK] Seq=4178 Ack=2531 Win=94464 Len=0 TSval=3069976 TSecr=4059508012"
"181","8.185717","192.168.137.119","216.58.219.46","TCP","66","37513  >  443 [ACK] Seq=4178 Ack=2577 Win=94464 Len=0 TSval=3069976 TSecr=4059508012"
"182","8.185717","192.168.137.119","216.58.219.46","TLSv1.2","112","Application Data"
"183","8.187627","192.168.137.119","54.192.142.208","TCP","66","40829  >  443 [ACK] Seq=190 Ack=2607 Win=93184 Len=0 TSval=3069977 TSecr=3577308886"
"184","8.192223","216.58.219.46","192.168.137.119","TCP","66","443  >  37513 [ACK] Seq=2577 Ack=4224 Win=54528 Len=0 TSval=4059508022 TSecr=3069976"
"185","8.224977","192.168.137.119","54.192.142.208","TLSv1.2","192","Client Key Exchange, Change Cipher Spec, Encrypted Handshake Message"
"186","8.241167","54.192.142.208","192.168.137.119","TLSv1.2","308","New Session Ticket, Change Cipher Spec, Encrypted Handshake Message"
"187","8.245766","192.168.137.119","54.192.142.208","TLSv1.2","289","Application Data"
"188","8.273950","54.192.142.208","192.168.137.119","TLSv1.2","804","Application Data"
"189","8.274124","54.192.142.208","192.168.137.119","TLSv1.2","100","Application Data"
"190","8.275315","54.192.142.208","192.168.137.119","TLSv1.2","97","Encrypted Alert"
"191","8.298425","54.192.142.208","192.168.137.119","TCP","97","[TCP Retransmission] 443  >  40829 [FIN, PSH, ACK] Seq=3621 Ack=539 Win=31232 Len=31 TSval=3577308898 TSecr=3069994"
"192","8.338705","192.168.137.119","54.192.142.208","TCP","78","40829  >  443 [ACK] Seq=539 Ack=3653 Win=98816 Len=0 TSval=3070022 TSecr=3577308894 SLE=3621 SRE=3653"
"193","8.340354","192.168.137.119","54.192.142.208","TLSv1.2","97","Encrypted Alert"
"194","8.340355","192.168.137.119","54.192.142.208","TCP","66","40829  >  443 [RST, ACK] Seq=570 Ack=3653 Win=98816 Len=0 TSval=3070023 TSecr=3577308894"
"195","8.355829","54.192.142.208","192.168.137.119","TCP","54","443  >  40829 [RST] Seq=3653 Win=0 Len=0"
"196","8.517769","192.168.137.119","172.217.11.170","TCP","74","[TCP Retransmission] 40083  >  443 [SYN] Seq=0 Win=65535 Len=0 MSS=1460 SACK_PERM=1 TSval=3070076 TSecr=0 WS=256"
"197","8.523871","172.217.11.170","192.168.137.119","TCP","74","443  >  40083 [SYN, ACK] Seq=0 Ack=1 Win=42408 Len=0 MSS=1380 SACK_PERM=1 TSval=3936888021 TSecr=3069775 WS=256"
"198","8.529001","192.168.137.119","172.217.11.170","TCP","66","40083  >  443 [ACK] Seq=1 Ack=1 Win=87808 Len=0 TSval=3070079 TSecr=3936888021"
"199","8.536386","192.168.137.119","172.217.11.170","TLSv1.2","264","Client Hello"
"200","8.542454","172.217.11.170","192.168.137.119","TCP","66","443  >  40083 [ACK] Seq=1 Ack=199 Win=43520 Len=0 TSval=3936888040 TSecr=3070081"
"201","8.543563","172.217.11.170","192.168.137.119","TLSv1.2","1440","Server Hello"
"202","8.543810","172.217.11.170","192.168.137.119","TCP","1440","443  >  40083 [ACK] Seq=1375 Ack=199 Win=43520 Len=1374 TSval=3936888040 TSecr=3070081 [TCP segment of a reassembled PDU]"
"203","8.545617","172.217.11.170","192.168.137.119","TLSv1.2","621","Certificate, Server Key Exchange, Server Hello Done"
"204","8.548751","192.168.137.119","172.217.11.170","TCP","66","40083  >  443 [ACK] Seq=199 Ack=1375 Win=90368 Len=0 TSval=3070085 TSecr=3936888040"
"205","8.548752","192.168.137.119","172.217.11.170","TCP","66","40083  >  443 [ACK] Seq=199 Ack=2749 Win=93184 Len=0 TSval=3070085 TSecr=3936888040"
"206","8.549987","192.168.137.119","172.217.11.170","TCP","66","40083  >  443 [ACK] Seq=199 Ack=3304 Win=96000 Len=0 TSval=3070085 TSecr=3936888040"
"207","8.575578","192.168.137.119","172.217.11.170","TLSv1.2","192","Client Key Exchange, Change Cipher Spec, Encrypted Handshake Message"
"208","8.606995","172.217.11.170","192.168.137.119","TLSv1.2","117","Change Cipher Spec, Encrypted Handshake Message"
"209","8.665547","192.168.137.119","172.217.11.170","TCP","1434","40083  >  443 [ACK] Seq=325 Ack=3355 Win=96000 Len=1368 TSval=3070120 TSecr=3936888079 [TCP segment of a reassembled PDU]"
"210","8.665549","192.168.137.119","172.217.11.170","TLSv1.2","219","Application Data"
"211","8.684301","172.217.11.170","192.168.137.119","TCP","66","443  >  40083 [ACK] Seq=3355 Ack=1846 Win=49152 Len=0 TSval=3936888171 TSecr=3070120"
"212","8.710319","192.168.137.119","172.217.11.170","TCP","74","[TCP Retransmission] 40080  >  443 [SYN] Seq=0 Win=65535 Len=0 MSS=1460 SACK_PERM=1 TSval=3070134 TSecr=0 WS=256"
"213","8.716538","172.217.11.170","192.168.137.119","TCP","74","443  >  40080 [SYN, ACK] Seq=0 Ack=1 Win=42408 Len=0 MSS=1380 SACK_PERM=1 TSval=3367149801 TSecr=3069232 WS=256"
"214","8.717181","172.217.11.170","192.168.137.119","TLSv1.2","439","Application Data"
"215","8.720056","192.168.137.119","172.217.11.170","TCP","66","40080  >  443 [ACK] Seq=1 Ack=1 Win=87808 Len=0 TSval=3070136 TSecr=3367149801"
"216","8.734519","192.168.137.119","172.217.11.170","TLSv1.2","264","Client Hello"
"217","8.745303","172.217.11.170","192.168.137.119","TCP","66","443  >  40080 [ACK] Seq=1 Ack=199 Win=43520 Len=0 TSval=3367149824 TSecr=3070141"
"218","8.745804","172.217.11.170","192.168.137.119","TLSv1.2","213","Server Hello, Change Cipher Spec, Encrypted Handshake Message"
"219","8.752254","192.168.137.119","172.217.11.170","TCP","66","40080  >  443 [ACK] Seq=199 Ack=148 Win=88832 Len=0 TSval=3070146 TSecr=3367149825"
"220","8.756562","192.168.137.119","172.217.11.170","TLSv1.2","117","Change Cipher Spec, Encrypted Handshake Message"
"221","8.756563","192.168.137.119","172.217.11.170","TCP","1434","40080  >  443 [ACK] Seq=250 Ack=148 Win=88832 Len=1368 TSval=3070147 TSecr=3367149825 [TCP segment of a reassembled PDU]"
"222","8.758040","192.168.137.119","172.217.11.170","TCP","66","40083  >  443 [ACK] Seq=1846 Ack=3728 Win=98816 Len=0 TSval=3070148 TSecr=3936888215"
"223","8.764844","172.217.11.170","192.168.137.119","TCP","66","443  >  40080 [ACK] Seq=148 Ack=1618 Win=46336 Len=0 TSval=3367149847 TSecr=3070147"
"224","8.768643","192.168.137.119","172.217.11.170","TLSv1.2","568","Application Data"
"225","8.820402","172.217.11.170","192.168.137.119","TCP","66","443  >  40080 [ACK] Seq=148 Ack=2120 Win=49152 Len=0 TSval=3367149862 TSecr=3070151"
"226","8.867743","172.217.11.170","192.168.137.119","TLSv1.2","439","Application Data"
"227","8.923840","192.168.137.119","172.217.11.170","TCP","66","40080  >  443 [ACK] Seq=2120 Ack=521 Win=89856 Len=0 TSval=3070198 TSecr=3367149950"
"228","8.966637","192.168.137.119","172.217.11.170","TCP","1434","40083  >  443 [ACK] Seq=1846 Ack=3728 Win=98816 Len=1368 TSval=3070209 TSecr=3936888215 [TCP segment of a reassembled PDU]"
"229","8.966642","192.168.137.119","172.217.11.170","TLSv1.2","737","Application Data"
"230","8.972148","172.217.11.170","192.168.137.119","TCP","66","443  >  40083 [ACK] Seq=3728 Ack=3885 Win=54528 Len=0 TSval=3936888470 TSecr=3070209"
"231","9.109283","172.217.11.170","192.168.137.119","TLSv1.2","625","Application Data"
"232","9.113911","172.217.11.170","192.168.137.119","TLSv1.2","604","Application Data"
"233","9.126397","172.217.11.170","192.168.137.119","TLSv1.2","100","Application Data"
"234","9.163591","172.217.11.170","192.168.137.119","TCP","100","[TCP Retransmission] 443  >  40083 [PSH, ACK] Seq=4825 Ack=3885 Win=54528 Len=34 TSval=3936888654 TSecr=3070209"
"235","9.186755","192.168.137.119","172.217.11.170","TCP","66","40083  >  443 [ACK] Seq=3885 Ack=4287 Win=101376 Len=0 TSval=3070276 TSecr=3936888601"
"236","9.189128","192.168.137.119","172.217.11.170","TCP","66","40083  >  443 [ACK] Seq=3885 Ack=4825 Win=104192 Len=0 TSval=3070277 TSecr=3936888601"
"237","9.189129","192.168.137.119","172.217.11.170","TCP","66","40083  >  443 [ACK] Seq=3885 Ack=4859 Win=104192 Len=0 TSval=3070277 TSecr=3936888602"
"238","9.189130","192.168.137.119","172.217.11.170","TCP","78","[TCP Dup ACK 237#1] 40083  >  443 [ACK] Seq=3885 Ack=4859 Win=104192 Len=0 TSval=3070277 TSecr=3936888654 SLE=4825 SRE=4859"
"239","10.686745","192.168.137.119","216.58.219.46","TCP","74","[TCP Retransmission] 37507  >  443 [SYN] Seq=0 Win=65535 Len=0 MSS=1460 SACK_PERM=1 TSval=3070704 TSecr=0 WS=256"
"240","10.686746","192.168.137.119","54.243.113.224","TCP","74","[TCP Retransmission] 37361  >  443 [SYN] Seq=0 Win=65535 Len=0 MSS=1460 SACK_PERM=1 TSval=3070704 TSecr=0 WS=256"
"241","10.691182","216.58.219.46","192.168.137.119","TCP","74","443  >  37507 [SYN, ACK] Seq=0 Ack=1 Win=42408 Len=0 MSS=1380 SACK_PERM=1 TSval=632069618 TSecr=3068598 WS=256"
"242","10.694716","216.58.219.46","192.168.137.119","TCP","74","[TCP Retransmission] 443  >  37507 [SYN, ACK] Seq=0 Ack=1 Win=42408 Len=0 MSS=1380 SACK_PERM=1 TSval=632069699 TSecr=3068598 WS=256"
"243","10.698276","192.168.137.119","216.58.219.46","TCP","66","37507  >  443 [ACK] Seq=1 Ack=1 Win=87808 Len=0 TSval=3070729 TSecr=632069618"
"244","10.702437","192.168.137.119","216.58.219.46","TLSv1.2","275","Client Hello"
"245","10.702438","192.168.137.119","216.58.219.46","TCP","66","[TCP Dup ACK 243#1] 37507  >  443 [ACK] Seq=210 Ack=1 Win=87808 Len=0 TSval=3070731 TSecr=632069618"
"246","10.708304","216.58.219.46","192.168.137.119","TCP","66","443  >  37507 [ACK] Seq=1 Ack=210 Win=43520 Len=0 TSval=632069714 TSecr=3070731"
"247","10.708506","216.58.219.46","192.168.137.119","TLSv1.2","217","Server Hello, Change Cipher Spec, Encrypted Handshake Message"
"248","10.712739","192.168.137.119","216.58.219.46","TCP","66","37507  >  443 [ACK] Seq=210 Ack=152 Win=88832 Len=0 TSval=3070734 TSecr=632069714"
"249","10.714203","192.168.137.119","216.58.219.46","TLSv1.2","282","Change Cipher Spec, Encrypted Handshake Message, Encrypted Handshake Message"
"250","10.763479","216.58.219.46","192.168.137.119","TCP","66","443  >  37507 [ACK] Seq=152 Ack=426 Win=44800 Len=0 TSval=632069726 TSecr=3070735"
"251","10.821390","192.168.137.119","216.58.219.46","TLSv1.2","985","Application Data"
"252","10.841095","216.58.219.46","192.168.137.119","TCP","66","443  >  37507 [ACK] Seq=152 Ack=1345 Win=46592 Len=0 TSval=632069833 TSecr=3070767"
"253","10.877560","216.58.219.46","192.168.137.119","TLSv1.2","524","Application Data"
"254","10.881057","216.58.219.46","192.168.137.119","TLSv1.2","407","Application Data"
"255","10.881375","216.58.219.46","192.168.137.119","TLSv1.2","193","Application Data"
"256","10.883797","216.58.219.46","192.168.137.119","TLSv1.2","100","Application Data"
"257","10.905099","192.168.137.119","216.58.219.46","TCP","66","37507  >  443 [ACK] Seq=1345 Ack=951 Win=90880 Len=0 TSval=3070792 TSecr=632069879"
"258","10.921887","192.168.137.119","216.58.219.46","TCP","66","37507  >  443 [ACK] Seq=1345 Ack=1112 Win=90880 Len=0 TSval=3070797 TSecr=632069880"
"259","10.984480","192.168.137.119","54.192.142.208","TCP","74","40835  >  443 [SYN] Seq=0 Win=65535 Len=0 MSS=1460 SACK_PERM=1 TSval=3070816 TSecr=0 WS=256"
"260","11.230275","192.168.137.119","54.192.142.208","TCP","74","40836  >  443 [SYN] Seq=0 Win=65535 Len=0 MSS=1460 SACK_PERM=1 TSval=3070889 TSecr=0 WS=256"
"261","11.989815","192.168.137.119","54.192.142.208","TCP","74","[TCP Retransmission] 40835  >  443 [SYN] Seq=0 Win=65535 Len=0 MSS=1460 SACK_PERM=1 TSval=3071117 TSecr=0 WS=256"
"262","11.997064","54.192.142.208","192.168.137.119","TCP","74","443  >  40835 [SYN, ACK] Seq=0 Ack=1 Win=28960 Len=0 MSS=1386 SACK_PERM=1 TSval=3577308163 TSecr=3070816 WS=256"
"263","12.000431","192.168.137.119","54.192.142.208","TCP","66","40835  >  443 [ACK] Seq=1 Ack=1 Win=87808 Len=0 TSval=3071121 TSecr=3577308163"
"264","12.002178","192.168.137.119","54.192.142.208","TLSv1.2","272","Client Hello"
"265","12.004791","54.192.142.208","192.168.137.119","TCP","74","[TCP Out-Of-Order] 443  >  40835 [SYN, ACK] Seq=0 Ack=1 Win=28960 Len=0 MSS=1386 SACK_PERM=1 TSval=3577308163 TSecr=3070816 WS=256"
"266","12.008106","192.168.137.119","54.192.142.208","TCP","66","[TCP Dup ACK 263#1] 40835  >  443 [ACK] Seq=207 Ack=1 Win=87808 Len=0 TSval=3071123 TSecr=3577308163"
"267","12.017052","54.192.142.208","192.168.137.119","TCP","66","443  >  40835 [ACK] Seq=1 Ack=207 Win=30208 Len=0 TSval=3577308164 TSecr=3071121"
"268","12.019676","54.192.142.208","192.168.137.119","TLSv1.2","1440","Server Hello"
"269","12.022973","192.168.137.119","54.192.142.208","TCP","66","40835  >  443 [ACK] Seq=207 Ack=1375 Win=90368 Len=0 TSval=3071127 TSecr=3577308165"
"270","12.038991","54.192.142.208","192.168.137.119","TLSv1.2","1440","Certificate [TCP segment of a reassembled PDU]"
"271","12.039283","54.192.142.208","192.168.137.119","TLSv1.2","1347","Certificate Status, Server Key Exchange, Server Hello Done"
"272","12.042967","192.168.137.119","54.192.142.208","TCP","66","40835  >  443 [ACK] Seq=207 Ack=2749 Win=93184 Len=0 TSval=3071133 TSecr=3577308166"
"273","12.042968","192.168.137.119","54.192.142.208","TCP","66","40835  >  443 [ACK] Seq=207 Ack=4030 Win=96000 Len=0 TSval=3071133 TSecr=3577308166"
"274","12.051364","192.168.137.119","54.192.142.208","TLSv1.2","192","Client Key Exchange, Change Cipher Spec, Encrypted Handshake Message"
"275","12.066685","54.192.142.208","192.168.137.119","TLSv1.2","308","New Session Ticket, Change Cipher Spec, Encrypted Handshake Message"
"276","12.066983","54.192.142.208","192.168.137.119","TLSv1.2","135","Application Data"
